,MCQ,Choices,Correct
0,What was the original goal of machine learning as a scientific endeavor?,a: To develop expert systems | b: To achieve artificial intelligence | c: To improve data storage | d: To enhance computer graphics,b
1,Which approach caused a rift between AI and machine learning?,"a: Neural networks | b: Probabilistic reasoning | c: Logical, knowledge-based approach | d: Pattern recognition",c
2,What was the main success of researchers like John Hopfield and Geoffrey Hinton in the mid-1980s?,a: Development of expert systems | b: Invention of neural networks | c: Reinvention of backpropagation | d: Creation of fuzzy logic,c
3,In which decade did machine learning start to flourish as its own field?,a: 1970s | b: 1980s | c: 1990s | d: 2000s,c
4,What did machine learning shift its focus towards in the 1990s?,"a: Symbolic approaches | b: Methods from statistics, fuzzy logic, and probability theory | c: Expert systems | d: Data acquisition techniques",b
